Clearance Tracking Number,Lead Author,L/C/O,Title,Product Subtype,Research Program Area,Date Completed
ORD-001525,Gerald Ankley,"ord - Office of Research and Development, nheerl - National Health and Environmental Effects Research Laboratory, med - Mid-Continent Ecology Division, tecb - Toxic Effects Characterization Branch",Development of methods to detect occurrence and effects of endocrine-disrupting chemicals: A fundamental shift in regulatory ecotoxicology,Peer Reviewed,Chemical Safety for Sustainability,11/26/2013
ORD-006186,Michael Kahl,"ord - Office of Research and Development, nheerl - National Health and Environmental Effects Research Laboratory, med - Mid-Continent Ecology Division","An inexpensive, temporally-integrated system for monitoring occurrence and biological effects of aquatic contaminants in the field",Peer Reviewed,Chemical Safety for Sustainability,7/16/2014
ORD-002183,Wesley Ingwersen,"ord - Office of Research and Development, nrmrl - National Risk Management Research Laboratory, std - Sustainable Technology Division, sab - Systems Analysis Branch",Integrated Metrics for Improving the Life Cycle Approach to Assessing Product System Sustainability,Peer Reviewed,Chemical Safety for Sustainability,3/19/2014
ORD-005888,Rogelio Tornero-Velez,"ord - Office of Research and Development, nerl - National Exposure Research Laboratory, heasd - Human Exposure and Atmospheric Sciences Division, edrb - Exposure and Dose Research Branch",Linking the SHEDS-Multimedia Exposure Model and a Pyrethroid Mixture PBPK Model: A Proof of Concept for Cumulative Assessment,Peer Reviewed,Chemical Safety for Sustainability,
ORD-008884,Michael-Rock Goldsmith,,DockScreen: A database of in silico biomolecular interactions to support computational toxicology,Peer Reviewed,Chemical Safety for Sustainability; Chemical Safety for Sustainability,3/24/2015
ORD-010036,David Meyer,"ord - Office of Research and Development, nrmrl - National Risk Management Research Laboratory, std - Sustainable Technology Division, sab - Systems Analysis Branch",Evaluating Sustainable Material Management Scenarios for Rare Earth Element Phosphors in Current Television Technology,Peer Reviewed,Chemical Safety for Sustainability,
ORD-005371,Michael Tsang,,Life cycle assessment for emerging materials: case study of a garden bed constructed from lumber produced with three different copper treatments,Peer Reviewed,Chemical Safety for Sustainability,2/2/2015
ORD-004935,Jennifer Meyer,,Reproductive physiology in eastern snapping turtles (Chelydra serpentina) exposed to runoff from a concentrated animal feeding operation,Peer Reviewed,Chemical Safety for Sustainability,10/28/2013
ORD-001941,Carlie LaLone,"ord - Office of Research and Development, nheerl - National Health and Environmental Effects Research Laboratory, med - Mid-Continent Ecology Division",Molecular target sequence similarity as a basis for species extrapolation to assess the ecological risk of chemicals with known modes of action,Peer Reviewed,Chemical Safety for Sustainability,11/4/2013
ORD-005533,Chenglian Feng,,Interspecies Correlation Estimation - Applications in Water Quality Criteria and Ecological Risk Assessment,Peer Reviewed,Chemical Safety for Sustainability,10/17/2013
ORD-002019,Leisha Vance,"ord - Office of Research and Development, nrmrl - National Risk Management Research Laboratory, std - Sustainable Technology Division, seb - Sustainable Environments Branch",Synthesis of Sustainable Energy Supply Chain by the P-Graph Framework,Peer Reviewed,Chemical Safety for Sustainability,11/20/2013
ORD-008233,Natalia Garcia-Reyero,,Integrated approach to explore the mechanisms of aromatase inhibition and recovery in fathead minnows (Pimephales promelas),Peer Reviewed,Chemical Safety for Sustainability,12/2/2014
ORD-005903,L.L. Aylward,,Relationships of Chemical Concentrations in Maternal and Cord Blood: A Review of Available Data,Peer Reviewed,Chemical Safety for Sustainability,4/25/2014
ORD-007259,Said Hilal,"ord - Office of Research and Development, nerl - National Exposure Research Laboratory, erd - Ecosystems Research Division, pmb - Processes and Modeling Branch",Development of Monopole Interaction Models for Ionic Compounds. Part I: Estimation of Aqueous Henry&rsquo;s Law Constants for Ions and Gas Phase pKa Values for Acidic Compounds,Peer Reviewed,Chemical Safety for Sustainability,4/25/2014
ORD-002853,Miyuki Breen,,Developing Predictive Approaches to Characterize Adaptive Responses of the Reproductive Endocrine Axis to Aromatase Inhibition II:  Computational Modeling,Peer Reviewed,Chemical Safety for Sustainability,12/19/2013
ORD-000874,Christopher Impellitteri,"ord - Office of Research and Development, nrmrl - National Risk Management Research Laboratory, wswrd - Water Supply & Water Resources Division, tteb - Treatment Technology Evaluation Branch","Transformation of Silver Nanoparticles in Fresh, Aged, and Incinerated Biosolids",Peer Reviewed,Chemical Safety for Sustainability,1/14/2014
ORD-011420,Thomas Knudsen,"ord - Office of Research and Development, ncct - National Center for Computational Toxicology",(Toxicological Sciences) FORUM - FutureTox II: In vitro Data and In Silico Models forPredictive Toxicology,Peer Reviewed,Chemical Safety for Sustainability,6/26/2015
ORD-011291,Kellie Fay,,Determination of metabolic stability using cryopreserved hepatocytes from rainbow trout (Oncorhynchus mykiss),Peer Reviewed,Chemical Safety for Sustainability,
ORD-006416,Adriana Bejarano,,Development and Practical Application of Oil and Dispersant Interspecies Correlation Models for Aquatic Species,Peer Reviewed,Chemical Safety for Sustainability,7/24/2014
ORD-005088,Dina  Proestou,,Targeted Approach to Identify Genetic Loci Associated with Evolved Dioxin Tolerance in Atlantic Killifish (Fundulus heteroclitus),Peer Reviewed,Chemical Safety for Sustainability,1/28/2014
ORD-001753,Nasir Baig,,Synthesis of unnatural amino acids via microwave-assisted regio-selective one-pot multi-component reactions of sulfamidates,Peer Reviewed,Chemical Safety for Sustainability,2/19/2014
ORD-005589,Jenna Cavallin,,"Integrated assessment of runoff from livestock farming operations: Analytical chemistry, in vitro bioassays, and in vivo fish exposures",Peer Reviewed,Chemical Safety for Sustainability,7/21/2014
ORD-007769,Edward H. Jones,,Transport and retention of zinc oxide nanoparticles in porous media: Effects of natural organic matter versus natural organic ligands at circumneutral pH,Peer Reviewed,Chemical Safety for Sustainability,
ORD-007491,Erwin Annys,,Advancing the 3Rs in Regulatory Toxicology - Carcinogenicity Testing: Scope for Harmonisation and Advancing the 3Rs in Regulated Sectors of the European Union,Peer Reviewed,Chemical Safety for Sustainability,11/17/2014
ORD-008086,Mingshu Wang,,promoting Ecohealth Through Open Regulatory Software Platforms,Peer Reviewed,Chemical Safety for Sustainability,
ORD-005078,Jason Berninger,"ord - Office of Research and Development, nheerl - National Health and Environmental Effects Research Laboratory, med - Mid-Continent Ecology Division","Using transcriptomic tools to evaluate biological effects across effluent gradients at a diverse set of study sites in Minnesota, USA",Peer Reviewed,Chemical Safety for Sustainability,2/18/2014
ORD-008240,Robin VanMeter,,Estimating terrestrial amphibian pesticide body burden through dermal exposure,Peer Reviewed,Chemical Safety for Sustainability,12/1/2014
ORD-003560,Carlie LaLone,"ord - Office of Research and Development, nheerl - National Health and Environmental Effects Research Laboratory, med - Mid-Continent Ecology Division","Cross species sensitivity to a novel androgen receptor agonist of potential environmental concern, spironolactone",Peer Reviewed,Chemical Safety for Sustainability,10/17/2013
ORD-002523,Gerardo Ruiz-Mercado,"ord - Office of Research and Development, nrmrl - National Risk Management Research Laboratory, std - Sustainable Technology Division, gcb - Green Chemistry Branch",Sustainability Indicators for Chemical Processes: III. Biodiesel Case Study,Peer Reviewed,Chemical Safety for Sustainability,11/20/2013
ORD-007418,TeresaD Green,"ord - Office of Research and Development, nheerl - National Health and Environmental Effects Research Laboratory, istd - Integrated Systems Toxicology Division, pb - Pharmacokinetics Branch",Comparative Cytotoxicity of Silver Nanomaterials in a Murine Macrophage Cell Line,Peer Reviewed,Chemical Safety for Sustainability,
ORD-009894,Drew Ekman,"ord - Office of Research and Development, nerl - National Exposure Research Laboratory, erd - Ecosystems Research Division, pmb - Processes and Modeling Branch",Metabolite profiling of fish skin mucus: a novel approach for minimally-invasive environmental exposure monitoring and surveillance,Peer Reviewed,Chemical Safety for Sustainability,3/25/2015
ORD-005400,Samuel Mwilu,"ord - Office of Research and Development, nerl - National Exposure Research Laboratory, esd - Environmental Sciences Division",Separation and measurement of silver nanoparticles and silver ions using magnetic particles,Peer Reviewed,Chemical Safety for Sustainability,12/17/2015
ORD-003130,Chris Grulke,"ord - Office of Research and Development, nerl - National Exposure Research Laboratory, heasd - Human Exposure and Atmospheric Sciences Division, edrb - Exposure and Dose Research Branch",PROcEED: Probabilistic reverse dosimetry approaches for estimating exposure distributions,Peer Reviewed,Chemical Safety for Sustainability,8/16/2013
ORD-003220,Edward  Perkins,,Current perspectives on the use of alternative species in human health and ecological hazard assessments,Peer Reviewed,Chemical Safety for Sustainability,10/29/2013
ORD-005350,Andrea C. Blaine,,Uptake of perfluoroalkyl acids into edible crops via land applied biosolids: Field and greenhouse studies,Peer Reviewed,Chemical Safety for Sustainability,3/23/2015
ORD-003213,Kimberly Nelson,"ord - Office of Research and Development, nheerl - National Health and Environmental Effects Research Laboratory, ged - Gulf Ecology Division, beprb - Biological Effects and Population Response Branch",Optimization of Whole-body Zebrafish Sectioning Methods for Mass Spectrometry Imaging (2013),Peer Reviewed,Chemical Safety for Sustainability,9/6/2013
ORD-004214,Joachim Pleil,"ord - Office of Research and Development, nerl - National Exposure Research Laboratory, heasd - Human Exposure and Atmospheric Sciences Division, mdab - Methods Development and Application Branch",Meeting Reports for 2013: Recent Advances in Breath Biomarker Research,Peer Reviewed,Chemical Safety for Sustainability,8/27/2013
ORD-004005,Joachim Pleil,"ord - Office of Research and Development, nerl - National Exposure Research Laboratory, heasd - Human Exposure and Atmospheric Sciences Division, mdab - Methods Development and Application Branch",Estimating lifetime risk from spot biomarker data and intra&#8208;class correlation coefficients (ICC),Peer Reviewed,Chemical Safety for Sustainability,11/13/2013
ORD-004108,Wen-Che Hou,,Sunlight-Driven Reduction of Silver Ions by Natural Organic Matter: Formation and Transformation of Silver Nanoparticles,Peer Reviewed,Chemical Safety for Sustainability,9/25/2013
ORD-008498,Dengjun Wang,,Transport of Fluorescently Labeled Hydroxyapatite Nanoparticles in Saturated Granular Media at Environmentally Relevant Concentrations of Surfactants,Peer Reviewed,Chemical Safety for Sustainability,
ORD-004836,Xiaojun Chang,,Multiwalled Carbon Nanotube Deposition on Model Environmental Surfaces,Peer Reviewed,Chemical Safety for Sustainability,9/25/2013
ORD-004712,Shibin Li,,Phototoxicity of TiO2 nanoparticles to a freshwater benthic amphipod: are benthic systems at risk?,Peer Reviewed,Chemical Safety for Sustainability,1/2/2014
ORD-008592,Indranil Chowdhury,,Interactions of Graphene Oxide Nanomaterials with Natural Organic Matter and Metal Oxide Surfaces,Peer Reviewed,Chemical Safety for Sustainability,6/20/2014
ORD-006038,Nasir Baig,,Ruthenium on chitosan: A recyclable heterogeneous catalyst for aqueous hydration of nitriles to amides,Peer Reviewed,Chemical Safety for Sustainability,4/3/2014
ORD-005133,Ryo Sekine,,Surface Immobilisation of Engineered Nanomaterials for in-situ Study of their Environmental Transformations and Fate,Peer Reviewed,Chemical Safety for Sustainability,11/19/2013
ORD-006347,Rajender Varma,"ord - Office of Research and Development, nrmrl - National Risk Management Research Laboratory, std - Sustainable Technology Division, cpb - Clean Processes Branch",'Greener' Biomimetic Synthesis of Nanomaterials using Anti-oxidants from Plants and Microwaves,Peer Reviewed,Chemical Safety for Sustainability,3/13/2014
ORD-012021,Mark Strynar,"ord - Office of Research and Development, nerl - National Exposure Research Laboratory, heasd - Human Exposure and Atmospheric Sciences Division, mdab - Methods Development and Application Branch",Identification of novel perfluoroalkyl ether carboxylic acids (PFECAs) and sulfonic acids (PFESAs) in natural waters using accurate mass time-of-flight mass spectrometry (TOFMS),Peer Reviewed,Chemical Safety for Sustainability,
ORD-002557,Sudhakar Takkellapati,"ord - Office of Research and Development, nrmrl - National Risk Management Research Laboratory, std - Sustainable Technology Division, cpb - Clean Processes Branch",Microwave assisted alkylation of amines with alcohols; magnetically recoverable catalysis,Peer Reviewed,Chemical Safety for Sustainability,5/21/2014
ORD-005004,R. G. Silva,,Polymorph-dependent titanium dioxide nanoparticle dissolution in acidic and alkali digestions,Peer Reviewed,Chemical Safety for Sustainability,5/22/2014
ORD-010990,Ingrid Druwe,,Sensitivity of neuroprogenitor cells to chemical-induced apoptosis using a multiplexed assay suitable for high-throughput screening*,Peer Reviewed,Chemical Safety for Sustainability,8/7/2015
ORD-000917,Richard Hertzberg,,A Four Step Approach to Evaluate Mixtures for Consistency with Dose Addition,Peer Reviewed,Chemical Safety for Sustainability,3/27/2014
ORD-005082,Erik Andersen,"ord - Office of Research and Development, nerl - National Exposure Research Laboratory, heasd - Human Exposure and Atmospheric Sciences Division, emab - Exposure Measurements and Analysis Branch",Evaluating an alternative method for rapid urinary creatinine determination,Peer Reviewed,Chemical Safety for Sustainability,10/23/2014
ORD-000259,Jerome Goldman,"ord - Office of Research and Development, nheerl - National Health and Environmental Effects Research Laboratory, tad - Toxicology Assessment Division, etb - Endocrine Toxicology Branch","Atrazine-induced elevation or attenuation of the LH surge in the ovariectomized, estrogen-primed female rat: role of adrenal progesterone",Peer Reviewed,Chemical Safety for Sustainability,3/26/2014
ORD-001714,Matthew Etterson,"ord - Office of Research and Development, nheerl - National Health and Environmental Effects Research Laboratory, med - Mid-Continent Ecology Division","Landscape and regional context differentially affect nest parasitism and nest predation for Wood Thrush in central Virginia, USA",Peer Reviewed,Chemical Safety for Sustainability,3/27/2014
ORD-000682,Hakan Andersson,,Scientific and regulatory policy committee (SRPC) paper: Assessment of Circulating Hormones in Nonclinical Toxicity Studies. III Female Reproductive Hormones,Peer Reviewed,Chemical Safety for Sustainability,3/26/2014
ORD-015925,Thabet Tolaymat,"ord - Office of Research and Development, nrmrl - National Risk Management Research Laboratory, lrpcd - Land Remediation & Pollution Control Division","The Path Towards Healthier Societies, Environments &amp; Economies: A Broader Perspective for Sustainable Engineered Nanomaterials",Peer Reviewed,Chemical Safety for Sustainability,
ORD-009715,Jason Berninger,,Prioritization of pharmaceuticals for potential environmental hazard through leveraging a large scale mammalian pharmacological dataset,Peer Reviewed,Chemical Safety for Sustainability,2/17/2016
ORD-010391,Kaberi Das,"ord - Office of Research and Development, nheerl - National Health and Environmental Effects Research Laboratory, tad - Toxicology Assessment Division, dtb - Developmental Toxicology Branch",Developmental Toxicity of Perfluoronanoic Acid in Mice,Peer Reviewed,Chemical Safety for Sustainability,5/4/2015
ORD-006694,Leah G. Huling,,Titanium Dioxide Nano- and Micro-particles:  Transport and Fate in Wastewater Treatment Systems,Peer Reviewed,Chemical Safety for Sustainability,
ORD-005659,Rajender Varma,"ord - Office of Research and Development, nrmrl - National Risk Management Research Laboratory, std - Sustainable Technology Division, cpb - Clean Processes Branch",Journey on greener pathways: from the use of alternate energy inputs and benign reaction media to sustainable applications of nano-catalysts in synthesis and environmental remediation,Peer Reviewed,Chemical Safety for Sustainability,4/3/2014
ORD-008797,Yuanyuan  Yin,,Essential Set of Molecular Descriptors for ADME Prediction in Drug and Environmental Chemical Space,Peer Reviewed,Chemical Safety for Sustainability,
ORD-015388,Endalkachew Sahle-Demessie,"ord - Office of Research and Development, nrmrl - National Risk Management Research Laboratory, std - Sustainable Technology Division, cpb - Clean Processes Branch",Weathering of Polyethylene-Nano-clay Composites and the Release of Nanoparticles,Peer Reviewed,Chemical Safety for Sustainability,
ORD-005956,Gary Klinefelter,"ord - Office of Research and Development, nheerl - National Health and Environmental Effects Research Laboratory, tad - Toxicology Assessment Division, rtb - Reproductive Toxicology Branch",Statin Drugs Markedly Inhibit Testosterone Production by Rat Leydig Cells In Vitro: Implications for Men,Peer Reviewed,Chemical Safety for Sustainability,4/17/2014
ORD-006335,Jennifer Pierson,,A Public-Private Consortium Advances Cardiac Safety Evaluation: Achievements of the HESI Cardiac Safety Technical Committee,Peer Reviewed,Chemical Safety for Sustainability,4/4/2014
ORD-005455,Cynthiaj Wolf,"ord - Office of Research and Development, nheerl - National Health and Environmental Effects Research Laboratory, tad - Toxicology Assessment Division, dtb - Developmental Toxicology Branch",Evaluating the additivity of perfluoroalkyl acids (PFAAs) in binary combinations on peroxisome proliferator-activated receptor-a(PPARa) activation,Peer Reviewed,Chemical Safety for Sustainability,4/4/2014
ORD-016091,Xiaojun Chang,"ord - Office of Research and Development, nerl - National Exposure Research Laboratory, erd - Ecosystems Research Division, rsb - Regulatory Support Branch",Surfactant-Wrapped Multiwalled Carbon Nanotubes in Aquatic Systems: Surfactant Displacement in the Presence of Humic Acid,Peer Reviewed,Chemical Safety for Sustainability,
ORD-011209,Kathleen Jensen,"ord - Office of Research and Development, nheerl - National Health and Environmental Effects Research Laboratory, med - Mid-Continent Ecology Division",Effects of the anti-microbial contaminant triclocarban on the reproductive function and ovarian transcriptome of the fathead minnow (Pimephales promelas),Peer Reviewed,Chemical Safety for Sustainability,
ORD-015289,Gabriel Knudsen,,"Estimation of human percutaneous bioavailability for two novel brominated flame retardants, 2-ethylhexyl tetrabromobenzoate (EH-TBB) and bis(2-ethylhexyl) tetrabromophthalate (BEH-TEBP), using the parallelogram approach",Peer Reviewed,Chemical Safety for Sustainability,
ORD-007941,Ravi Srinivasan,,Comparison of energy-based indicators used in life cycle assessment tools for buildings,Peer Reviewed,Chemical Safety for Sustainability,6/18/2014
ORD-007035,Christina Powers,"ord - Office of Research and Development, ncea - National Center for Environmental Assessment, nceartp - National Center for Environmental Assessment-RTP Division, hpag - Hazardous Pollutant Assessment Group",Applying Comprehensive Environmental Assessment to Research Planning for Multiwalled Carbon Nanotubes: Refinements to Inform Future Stakeholder Engagement,Peer Reviewed,Chemical Safety for Sustainability,7/3/2014
ORD-003499,Leland Vane,"ord - Office of Research and Development, nrmrl - National Risk Management Research Laboratory, std - Sustainable Technology Division, cpb - Clean Processes Branch",Hybrid Vapor Stripping-Vapor Permeation Process for Recovery and Dehydration of 1-Butanol and Acetone/Butanol/Ethanol from Dilute Aqueous Solutions. Part 2. Experimental Validation with Simple Mixtures and Actual Fermentation Broth,Peer Reviewed,Chemical Safety for Sustainability,6/19/2014
ORD-009994,Lisa Truong,"ord - Office of Research and Development, ncct - National Center for Computational Toxicology",(TOXICOLOGIC PATHOLOGY)  Deriving Performance Confidence Limits to Develop Predictive Models for Systemic Toxicity using ToxRefDB,Peer Reviewed,Chemical Safety for Sustainability,
ORD-008462,Manuel Montano,,Current Status and Future Direction for Examining Engineered Nanoparticles in Natural Systems,Peer Reviewed,Chemical Safety for Sustainability,10/20/2014
ORD-003268,Melvin Anderson,,Dose-response approaches for nuclear receptor-mediated modes of action for liver carcinogenicity: Results of a workshop,Peer Reviewed,Chemical Safety for Sustainability,4/15/2014
ORD-008229,Deborah Segal,"ord - Office of Research and Development, ncea - National Center for Environmental Assessment, nceawa - National Center for Environmental Assessment- Washington Division, eigc - Effects Identification & Characterization Group",Evaluation of the ToxRTool's ability to rate the reliability of toxicological data for human health hazard assessments,Peer Reviewed,Chemical Safety for Sustainability,5/7/2015
ORD-008622,John Wambaugh,"ord - Office of Research and Development, ncct - National Center for Computational Toxicology",Dosimetric Anchoring of In Vivo and In Vitro Studies for Perfluorooctanoate and Perfluorooctanesulfonate,Peer Reviewed,Chemical Safety for Sustainability,5/16/2014
ORD-003166,AlberTinka J.  Murk,,Mechanism-based testing strategy using in vitro approaches for identification of thyroid hormone disrupting chemicals,Peer Reviewed,Chemical Safety for Sustainability,5/27/2014
ORD-004204,Jill Awkerman,"ord - Office of Research and Development, nheerl - National Health and Environmental Effects Research Laboratory, ged - Gulf Ecology Division, beprb - Biological Effects and Population Response Branch",Augmenting aquatic species sensitivity distributions with interspecies toxicity estimation models,Peer Reviewed,Chemical Safety for Sustainability,2/18/2014
ORD-004889,Kellie Fay,"ord - Office of Research and Development, nheerl - National Health and Environmental Effects Research Laboratory, med - Mid-Continent Ecology Division",Optimizing the use of rainbow trout hepatocytes for bioaccumulation assessments with fish,Peer Reviewed,Chemical Safety for Sustainability,4/18/2014
ORD-005501,Dalma Martinovic-Weigelt,,Transcriptomic-based effects monitoring for endocrine active chemicals: Assessing relative contribution of treated wastewater to downstream pollution,Peer Reviewed,Chemical Safety for Sustainability,2/18/2014
ORD-015303,Joachim Pleil,"ord - Office of Research and Development, nerl - National Exposure Research Laboratory, emmd - Exposure Methods & Measurement Division, ieib - Internal Exposure Indicators Branch","Cellular respiration: replicating in vivo systems biology for in vitro exploration of human exposome, microbiome, and disease pathogenesis biomarkers",Peer Reviewed,Chemical Safety for Sustainability,3/16/2016
ORD-005263,Manoj Gawande,,Greener iodination of arenes using sulphated ceria-zirconia catalysts in polyethylene glycol,Peer Reviewed,Chemical Safety for Sustainability,2/19/2014
ORD-000925,Lesley J.  Mills,"ord - Office of Research and Development, nheerl - National Health and Environmental Effects Research Laboratory, aed - Atlantic Ecology Division, peb - Population Ecology Branch",Modulation of Aromatase Activity as a Mode of Action for Endocrine Disrupting Chemicals in a Marine Fish,Peer Reviewed,Chemical Safety for Sustainability,2/19/2014
ORD-004825,Miguel  Pelaez,,Microcystin-LR removal from aqueous solutions using  a magnetically  separable N-doped TiO2  nanocomposite under visible light irradiation,Peer Reviewed,Chemical Safety for Sustainability,2/19/2014
ORD-007097,Manoj Gawande,,Microwave-Assisted Chemistry: Synthetic Applications for Rapid Assembly of Nanomaterials and Organics,Peer Reviewed,Chemical Safety for Sustainability,4/16/2014
ORD-007859,Jenna Strickland,,Metal Oxide Nanoparticles Alter Spontaneous Activity and GABAergic Responses in Cortical Netural Networks in Vitro,Peer Reviewed,Chemical Safety for Sustainability,
ORD-007866,John Cowden,"ord - Office of Research and Development, ncea - National Center for Environmental Assessment, nceartp - National Center for Environmental Assessment-RTP Division",Chemical-Induced Effects on Neurodevelopment: A Review of Animal and Human Studies,Peer Reviewed,Chemical Safety for Sustainability,
ORD-002931,Mary Gilbert,"ord - Office of Research and Development, nheerl - National Health and Environmental Effects Research Laboratory, tad - Toxicology Assessment Division, nb - Neurotoxicology Branch",An animal model of marginal iodine deficiency during development: The thyroid axis and neurodevelopmental outcome. ##,Peer Reviewed,Chemical Safety for Sustainability,4/4/2014
ORD-004222,Tatsuya Sueyoshi,,Flame retardant BDE-47 effectively activates nuclear receptor CAR in human primary hepatocytes,Peer Reviewed,Chemical Safety for Sustainability,4/2/2014
