Clearance Tracking Number,Lead Author,L/C/O,Title,Product Subtype,Research Program Area,Date Completed
ORD-008333,Sandy Raimondo,"ord - Office of Research and Development, nheerl - National Health and Environmental Effects Research Laboratory, ged - Gulf Ecology Division, beprb - Biological Effects and Population Response Branch",Developmental Toxicity of Louisiana Crude Oil-Spiked Sediment to Zebrafish,Peer Reviewed,Chemical Safety for Sustainability,8/7/2014
ORD-010901,Peter Egeghy,"ord - Office of Research and Development, nerl - National Exposure Research Laboratory, heasd - Human Exposure and Atmospheric Sciences Division, emab - Exposure Measurements and Analysis Branch",Advancing Computational Exposure Science to Enable Risk Assessment for the 21st Century,Peer Reviewed,Chemical Safety for Sustainability,
ORD-008834,Megan E. Sawyer,,Development of a Human Physiologically Based Pharmacokinetics (PBPK) Model For Extrapolation of Dermal Permeability Coefficients: A Case Study with Lindane,Peer Reviewed,Chemical Safety for Sustainability,
ORD-008302,Debalina Sengupta,,Industrial process system assessment: bridging process engineeringand life cycle assessment through multiscale modeling.,Peer Reviewed,Chemical Safety for Sustainability,10/1/2015
ORD-009314,Dan Villeneuve,"ord - Office of Research and Development, nheerl - National Health and Environmental Effects Research Laboratory, med - Mid-Continent Ecology Division",Adverse outcome pathway (AOP) development I:  Strategies and principles,Peer Reviewed,Chemical Safety for Sustainability,12/3/2014
ORD-007806,Krista Christensen,"ord - Office of Research and Development, ncea - National Center for Environmental Assessment, nceawa - National Center for Environmental Assessment- Washington Division, qrmg - Quantitative Risk Methods Group",Changes in epidemiologic associations with different exposure metrics: A case study of phthalate exposure associations with body mass index and waist circumference,Peer Reviewed,Chemical Safety for Sustainability; Human Health Risk Assessment,
ORD-008680,Laura Ellestad,,Environmental gestagens activate fathead minnow (Pimephales promelas) nuclear progesterone and androgen receptors in vitro,Peer Reviewed,Chemical Safety for Sustainability,10/23/2014
ORD-001386,Emilio Benfenati,,Using Toxicological Evidence from QSAR Models in Practice,Peer Reviewed,Chemical Safety for Sustainability,5/21/2014
ORD-008816,Dina Schreinemachers,"ord - Office of Research and Development, nheerl - National Health and Environmental Effects Research Laboratory, ephd - Environmental Public Health Division, eb - Epidemiology Branch",Perchlorate exposure is associated with oxidative stress and indicators of serum iron homeostasis among NHANES 2005-2008 subjects,Peer Reviewed,Chemical Safety for Sustainability,1/30/2015
ORD-003802,Nicole Kleinstreuer,,Phenotypic screening of the ToxCast chemical library to classify toxic and therapeutic mechanisms,Peer Reviewed,Chemical Safety for Sustainability,5/20/2014
ORD-004242,Marsha Morgan,"ord - Office of Research and Development, nerl - National Exposure Research Laboratory, heasd - Human Exposure and Atmospheric Sciences Division, emab - Exposure Measurements and Analysis Branch","Dietary predictors of young children&rsquo;s exposures to chlorpyrifos, permethrin, and 2,4-D using urinary biomonitoring",Peer Reviewed,Chemical Safety for Sustainability; Sustainable and Healthy Communities,5/8/2014
ORD-006546,Asa Bradham,,Flame Retardant Exposures in California Early Childhood Education Environments,Peer Reviewed,Chemical Safety for Sustainability,10/24/2014
ORD-005582,Ted Simon,,The Use of Mode of Action Information in Risk Assessment: Quantitative Key Events/Dose-Response Framework for Modeling the Dose-Response for Key Events,Peer Reviewed,Chemical Safety for Sustainability,8/14/2014
ORD-008537,Sotirios Vasileiadis,,Changes in Soil Microbial Communities and Diversity in Response to Long-Term Silver Exposure,Peer Reviewed,Chemical Safety for Sustainability,12/17/2015
ORD-011196,Matthew Stiegel,,Kidney injury biomarkers and urinary creatinine variability in nominally healthy adults,Peer Reviewed,Chemical Safety for Sustainability,12/1/2015
ORD-008860,Martin Phillips,,Analysis of Biomarker Utility using a PBPK Model for Carbaryl,Peer Reviewed,Chemical Safety for Sustainability; Chemical Safety for Sustainability,11/19/2014
ORD-012566,Sandy Raimondo,"ord - Office of Research and Development, nheerl - National Health and Environmental Effects Research Laboratory, ged - Gulf Ecology Division, beprb - Biological Effects and Population Response Branch","Assessing variability in chemical acute toxicity of unionid mussels: Influence of intra- and inter-laboratory testing, life stage, and species",Peer Reviewed,Chemical Safety for Sustainability,3/7/2016
ORD-009163,John Glaser,"ord - Office of Research and Development, nrmrl - National Risk Management Research Laboratory, std - Sustainable Technology Division, seb - Sustainable Environments Branch",Biocatalyst greenness,Peer Reviewed,Chemical Safety for Sustainability,2/6/2015
ORD-007355,Lara Settimio,,Fate and lability of silver in soils: effect of ageing,Peer Reviewed,Chemical Safety for Sustainability,6/25/2014
ORD-007366,Sharad Shelke,,"Iron Oxide-Supported Copper Oxide Nanoparticles (Nanocat-Fe-CuO): Magnetically Recyclable Catalysts for the Synthesis of Pyrazole Derivatives, 4-Methoxyaniline, and Ullmann-type Condensation Reactions",Peer Reviewed,Chemical Safety for Sustainability,7/10/2014
ORD-008395,Jurate Virkutyte,,Eco-Friendly Magnetic Iron Oxide Pillared Montmorillonite for Advanced Catalytic Degradation of Dichlorophenol,Peer Reviewed,Chemical Safety for Sustainability,7/10/2014
ORD-007885,Reuben Hudson,,Bare Magnetic Nanoparticles: Sustainable Synthesis and Applications in Catalytic Organic Transformations,Peer Reviewed,Chemical Safety for Sustainability,9/24/2014
ORD-009299,Nicholas Niemuth,,Metformin exposure at environmentally relevant concentrations causes potential endocrine disruption in adult male fish,Peer Reviewed,Chemical Safety for Sustainability,1/29/2015
ORD-005234,Rocky Goldsmith,"ord - Office of Research and Development, nerl - National Exposure Research Laboratory, heasd - Human Exposure and Atmospheric Sciences Division, edrb - Exposure and Dose Research Branch","Development of a Consumer Product Ingredient Database for Chemical Exposure
Screening and Prioritization",Peer Reviewed,Chemical Safety for Sustainability; Chemical Safety for Sustainability,8/1/2014
ORD-007880,William T. Route,,Spatial and Temporal Patterns in Concentrations of Perfluorinated Compounds in Bald Eagle Nestlings in the Upper Midwestern United States,Peer Reviewed,Chemical Safety for Sustainability,8/1/2014
ORD-007626,Ashley N. Parks,"ord - Office of Research and Development, nheerl - National Health and Environmental Effects Research Laboratory, aed - Atlantic Ecology Division, peb - Population Ecology Branch",On the Likelihood of Single-Walled Carbon Nanotubes Causing Adverse Marine Ecological Effects,Peer Reviewed,Chemical Safety for Sustainability,6/30/2014
ORD-009364,Bineyam  Mezgebe,,Biological Treatment of Water Disinfection Byproducts using Biotrickling Filter under Anoxic and Anaerobic Conditions,Peer Reviewed,Chemical Safety for Sustainability,
ORD-004155,Buchi Reddy,"ord - Office of Research and Development, nrmrl - National Risk Management Research Laboratory, std - Sustainable Technology Division, sab - Systems Analysis Branch",Flow Chemistry for Designing Sustainable Chemical Synthesis(journal article),Peer Reviewed,Chemical Safety for Sustainability,6/30/2014
ORD-007870,Wesley Ingwersen,"ord - Office of Research and Development, nrmrl - National Risk Management Research Laboratory, std - Sustainable Technology Division, sab - Systems Analysis Branch",A new data architecture for advancing life cycle assessment,Peer Reviewed,Chemical Safety for Sustainability,12/21/2015
ORD-006205,James Starr,"ord - Office of Research and Development, nerl - National Exposure Research Laboratory, heasd - Human Exposure and Atmospheric Sciences Division, mdab - Methods Development and Application Branch","Environmentally Relevant Mixing Ratios in Cumulative Assessments: A Study of the
Kinetics of Pyrethroids and Their Ester Cleavage Metabolites in Blood and Brain; and the Effect of a Pyrethroid Mixture on the Motor Activity of Rats",Peer Reviewed,Chemical Safety for Sustainability,7/16/2014
ORD-007559,Kellie Fay,"ord - Office of Research and Development, nheerl - National Health and Environmental Effects Research Laboratory, med - Mid-Continent Ecology Division",Intra- and inter-laboratory reliability of a cryopreserved trout hepatocyte assay for the prediction of chemical bioaccumulation potential,Peer Reviewed,Chemical Safety for Sustainability,8/4/2014
ORD-009383,Kristen E. Pleil,,Molecular epidemiological assessment of neuronal function in the BNST of non-human primates after chronic voluntary alcohol consumption,Peer Reviewed,Chemical Safety for Sustainability,
ORD-006796,Daniel Rotroff,,Predictive Endocrine Testing in the 21st Century Using In Vitro Assays of Estrogen Receptor Signaling Responses,Peer Reviewed,Chemical Safety for Sustainability,8/1/2014
ORD-005026,Martin Phillips,,A New Method for Generating Distribution of Biomonitoring Equivalents to Support Exposure Assessment and Prioritization,Peer Reviewed,Chemical Safety for Sustainability,7/25/2014
ORD-007470,Sheau-Fung Thai,"ord - Office of Research and Development, nheerl - National Health and Environmental Effects Research Laboratory, istd - Integrated Systems Toxicology Division, sbb - Systems Biology Branch",Differential genomic effects on signaling pathways by two different CeO2 nanoparticles in HepG2 cells,Peer Reviewed,Chemical Safety for Sustainability,
ORD-012549,Joachim Pleil,"ord - Office of Research and Development, nerl - National Exposure Research Laboratory, heasd - Human Exposure and Atmospheric Sciences Division, mdab - Methods Development and Application Branch",Comparing biomarker measurements to a normal range: when to use standard error of the mean (SEM) or standard deviation (SD) confidence intervals tests,Peer Reviewed,Chemical Safety for Sustainability,
ORD-013920,Dustin Kapraun,"ord - Office of Research and Development, ncct - National Center for Computational Toxicology",(Technometrics) Assessing Uncertainty in Parameter Estimates for the Hill Model of Concentration-Response,Peer Reviewed,Chemical Safety for Sustainability,
ORD-003133,Zhishi Guo,"ord - Office of Research and Development, nrmrl - National Risk Management Research Laboratory, appcd - Air Pollution Prevention & Control Division, iemb - Indoor Environment Management Branch",A framework for modeling non-steady state concentrations of semivolatile organic compounds indoors &#8213; I. Emissions from diffusional sources and sorption by interior surfaces,Peer Reviewed,Chemical Safety for Sustainability,4/13/2015
ORD-009315,Dan Villeneuve,"ord - Office of Research and Development, nheerl - National Health and Environmental Effects Research Laboratory, med - Mid-Continent Ecology Division",Adverse outcome pathway (AOP) development II:  Best practices,Peer Reviewed,Chemical Safety for Sustainability,12/3/2014
ORD-011799,Yating Cheng,,"The Long Non-coding RNA HOTTIP Enhances Pancreatic Cancer Cell Proliferation, Survival and Migration",Peer Reviewed,Chemical Safety for Sustainability,
ORD-013695,Richard Judson,"ord - Office of Research and Development, ncct - National Center for Computational Toxicology",(Nature Biotechnology) Analysis of the Effects of Cell Stress and Cytotoxicity on In Vitro Assay Activity in the ToxCast Dataset,Peer Reviewed,Chemical Safety for Sustainability,
ORD-003253,Jurate Virkutyte,,Transport of TiO2 Nanoparticles and Nanostructured Particles through a Porous Medium,Peer Reviewed,Chemical Safety for Sustainability,2/20/2014
ORD-007439,Ruby Bansal,,Polybrominated Diphenyl Ether (DE-71)Interferes with Thyroid Hormone Action Independent Of Effects On Circulating Levels of Thyroid Hormone in Male Rats,Peer Reviewed,Chemical Safety for Sustainability,5/7/2015
ORD-007037,Lok Pokhrel,"ord - Office of Research and Development, nheerl - National Health and Environmental Effects Research Laboratory, wed - Western Ecology Division, eeb - Ecological Effects Branch",Preferential Interaction of Na+ over K+ to Carboxylate-functionalized Silver Nanoparticles,Peer Reviewed,Chemical Safety for Sustainability,5/16/2014
ORD-007017,Patricia Schmieder,"ord - Office of Research and Development, nheerl - National Health and Environmental Effects Research Laboratory, med - Mid-Continent Ecology Division",A rule-based expert system for chemical prioritization using effects-based chemical categories,Peer Reviewed,Chemical Safety for Sustainability,5/16/2014
ORD-010407,Hongbo Ma,,Impact of solar UV radiation on toxicity of ZnO nanoparticles through photocatalytic reactive oxygen species (ROS) generation and photo-induced dissolution,Peer Reviewed,Chemical Safety for Sustainability,10/20/2014
ORD-014079,Dina Schreinemachers,"ord - Office of Research and Development, nheerl - National Health and Environmental Effects Research Laboratory, ephd - Environmental Public Health Division, eb - Epidemiology Branch",Effects of environmental pollutants on cellular iron homeostasis and ultimate links to human disease,Peer Reviewed,Chemical Safety for Sustainability,
ORD-007485,Judy S. LaKind,,"A Proposal for Assessing Study Quality: Biomonitoring, Environmental Epidemiology, and Short-Lived Chemicals (BEES-C) Instrument",Peer Reviewed,Chemical Safety for Sustainability,11/26/2014
ORD-005216,Miriam Jacobs,,In vitro metabolism and bioavailability tests for endocrine active substances:  What is needed next for regulatory purposes?,Peer Reviewed,Chemical Safety for Sustainability,6/10/2014
ORD-003797,John Glaser,"ord - Office of Research and Development, nrmrl - National Risk Management Research Laboratory, std - Sustainable Technology Division, seb - Sustainable Environments Branch",News: Multistep organic synthesis using flow chemistry,Peer Reviewed,Chemical Safety for Sustainability,6/19/2014
ORD-002612,Rajender Varma,"ord - Office of Research and Development, nrmrl - National Risk Management Research Laboratory, std - Sustainable Technology Division, cpb - Clean Processes Branch",Microwave-Assisted Synthesis of Mesoporous Nano-Hydroxyapatite Using Surfactant Templates,Peer Reviewed,Chemical Safety for Sustainability,6/19/2014
ORD-003498,Leland Vane,"ord - Office of Research and Development, nrmrl - National Risk Management Research Laboratory, std - Sustainable Technology Division, cpb - Clean Processes Branch",Hybrid Vapor Stripping-Vapor Permeation Process for Recovery and Dehydration of 1-Butanol and Acetone/Butanol/Ethanol from Dilute Aqueous Solutions. Part 1. Process Simulations,Peer Reviewed,Chemical Safety for Sustainability,6/19/2014
ORD-008158,Christina Powers,"ord - Office of Research and Development, ncea - National Center for Environmental Assessment, nceartp - National Center for Environmental Assessment-RTP Division, hpag - Hazardous Pollutant Assessment Group",Data dialogues: critical connections for designing and implementing future nanomaterial research,Peer Reviewed,Chemical Safety for Sustainability,4/24/2014
ORD-009776,K. R. Tatum-Gibbs,,"Effects of Toluene, Acrolein and Vinyl Chloride on Motor Activity of Drosophila Melanogaster",Peer Reviewed,Chemical Safety for Sustainability,5/8/2015
ORD-011036,Marco Cinelli,,A green chemistry-based classification model for the synthesis of silver nanoparticles,Peer Reviewed,Chemical Safety for Sustainability,5/13/2015
ORD-007102,Nasir Baig,,Magnetic silica supported palladium catalyst: synthesis of allyl aryl ethers in water,Peer Reviewed,Chemical Safety for Sustainability,12/10/2014
ORD-012183,Richard Becker,,Increasing scientific confidence in adverse outcome pathways: Application of tailored Bradford-Hill considerations for evaluating weight of evidence,Peer Reviewed,Chemical Safety for Sustainability,6/18/2015
ORD-011096,Wout Slob,,Shape and Steepness of Toxicological Dose-Response Relationships. Part I. Continuous Response Data,Peer Reviewed,Chemical Safety for Sustainability,12/12/2014
ORD-008219,John Wambaugh,"ord - Office of Research and Development, ncct - National Center for Computational Toxicology",High Throughput Heuristics for Prioritizing Human Exposure to Environmental Chemicals,Peer Reviewed,Chemical Safety for Sustainability,11/26/2014
ORD-009883,John Nichols,"ord - Office of Research and Development, nheerl - National Health and Environmental Effects Research Laboratory, adh - Office of the Associate Director for Health","Observed and modeled effects of pH on bioconcentration of diphenhydramine, a weakly basic pharmaceutical, by fathead minnows",Peer Reviewed,Chemical Safety for Sustainability,2/17/2016
ORD-012645,MichaelF Hughes,"ord - Office of Research and Development, nheerl - National Health and Environmental Effects Research Laboratory, istd - Integrated Systems Toxicology Division, pb - Pharmacokinetics Branch",Tissue time course and bioavailability of the pyrethroid insecticide bifenthrin in the Long-Evans rat,Peer Reviewed,Chemical Safety for Sustainability,
ORD-009779,Virginia C. Moser,"ord - Office of Research and Development, nheerl - National Health and Environmental Effects Research Laboratory, tad - Toxicology Assessment Division, nb - Neurotoxicology Branch",Assessment of Serum Biomarkers in Rats After Exposure to Pesticides of Different Chemical Classes,Peer Reviewed,Chemical Safety for Sustainability,12/31/2014
ORD-010205,Jie Liu,"ord - Office of Research and Development, ncct - National Center for Computational Toxicology",(CHEMICAL RESEARCH IN TOXICOLOGY)  Predicting hepatotoxicity using ToxCast in vitro bioactivity and chemical structure,Peer Reviewed,Chemical Safety for Sustainability,6/12/2015
ORD-011034,Anuj Rathi,,Microwave-Assisted Synthesis &ndash; Catalytic Applications in Aqueous Media,Peer Reviewed,Chemical Safety for Sustainability,2/18/2015
ORD-008505,Kristin Isaacs,"ord - Office of Research and Development, nerl - National Exposure Research Laboratory, heasd - Human Exposure and Atmospheric Sciences Division, emrb - Exposure Modeling Research Branch",SHEDS-HT: An Integrated Probabilistic Exposure Model for Prioritizing Exposures to Chemicals with Near-Field and Dietary Sources,Peer Reviewed,Chemical Safety for Sustainability,12/8/2014
ORD-013846,Shibin Li,"ord - Office of Research and Development, nheerl - National Health and Environmental Effects Research Laboratory, med - Mid-Continent Ecology Division",Impact of natural organic matter on particle behavior and phototoxicity of titanium dioxide nanoparticles,Peer Reviewed,Chemical Safety for Sustainability,11/16/2015
ORD-009025,Laura Chekli,,Analytical Characterisation of Nanoscale Zero-Valent Iron: A Methodological Review,Peer Reviewed,Chemical Safety for Sustainability; Chemical Safety for Sustainability,1/5/2016
ORD-009800,Tao Hong,,Spatiotemporal Sensitivity Analysis of Vertical Transport of Pesticides in Soil,Peer Reviewed,Chemical Safety for Sustainability,
ORD-011084,Gianluca Brunetti,,Fate of Zinc and Silver Engineered Nanoparticles in Sewerage Networks,Peer Reviewed,Chemical Safety for Sustainability,6/11/2015
ORD-007579,Huanhua Wang,"ord - Office of Research and Development, nheerl - National Health and Environmental Effects Research Laboratory, aed - Atlantic Ecology Division, peb - Population Ecology Branch","Toxicity, Bioaccumulation and Biotransformation of Silver Nanoparticles in Marine Organisms",Peer Reviewed,Chemical Safety for Sustainability,12/3/2014
ORD-008702,Nasir Baig,,Carbon-coated magnetic palladium: applications in partial oxidation of alcohols and coupling reactions.,Peer Reviewed,Chemical Safety for Sustainability,8/19/2014
ORD-007639,Chris Russom,"ord - Office of Research and Development, nheerl - National Health and Environmental Effects Research Laboratory, med - Mid-Continent Ecology Division",Development of an adverse outcome pathway for acetylcholinesterase inhibition leading to acute mortality,Peer Reviewed,Chemical Safety for Sustainability,9/22/2014
ORD-014481,Tim Shafer,"ord - Office of Research and Development, nheerl - National Health and Environmental Effects Research Laboratory, istd - Integrated Systems Toxicology Division, sbb - Systems Biology Branch",Assessment of inter-laboratory reproducibility of micro-electrode array-based measurements for neurotoxicity testing,Peer Reviewed,Chemical Safety for Sustainability,
ORD-009793,Jay Christensen,"ord - Office of Research and Development, nerl - National Exposure Research Laboratory, esd - Environmental Sciences Division, leb - Landscape Ecology Branch",Spatial Distribution of Small Water Body Types across Indiana Ecoregions,Peer Reviewed,Chemical Safety for Sustainability,6/25/2015
ORD-015119,Morgan Willming,,Acute toxicity prediction to threatened and endangered species using Interspecies Correlation Estimation (ICE) models,Peer Reviewed,Chemical Safety for Sustainability,
ORD-011283,Leland Vane,"ord - Office of Research and Development, nrmrl - National Risk Management Research Laboratory, std - Sustainable Technology Division, cpb - Clean Processes Branch",Effect of membrane and process characteristics on cost and energy usage for separating alcohol-water mixtures using hybrid vapor stripping-vapor permeation process,Peer Reviewed,Chemical Safety for Sustainability,1/4/2016
ORD-007137,Richard Judson,"ord - Office of Research and Development, ncct - National Center for Computational Toxicology","In Vitro and Modeling Approaches to Risk Assessment from the 
U.S. Environmental Protection Agency ToxCast Program",Peer Reviewed,Chemical Safety for Sustainability,8/4/2014
ORD-004824,Drew Ekman,"ord - Office of Research and Development, nerl - National Exposure Research Laboratory, erd - Ecosystems Research Division, pmb - Processes and Modeling Branch",Biological Effects&ndash;Based Tools for Monitoring Impacted Surface Waters in the Great Lakes: A Multiagency Program in Support of the Great Lakes Restoration Initiative,Peer Reviewed,Chemical Safety for Sustainability,11/28/2014
ORD-004292,Eric Waits,"ord - Office of Research and Development, nerl - National Exposure Research Laboratory, eerd - Ecological Exposure Research Division, merb - Molecular Ecology Research Branch","An integrated genetic linkage map and comparative genome analysis for the estuarine Atlantic killifish, Fundulus heteroclitus",Peer Reviewed,Chemical Safety for Sustainability,
ORD-007379,Steven Bradbury,"oppts - Office of Chemical Safety and Pollution Prevention, opp - Office of Pesticide Programs",Advancing computational toxicology: A selected review of the accomplishments of Gilman D. Veith (1944-2013),Peer Reviewed,Chemical Safety for Sustainability,8/5/2014
ORD-014724,Xiaoyu Liu,"ord - Office of Research and Development, nrmrl - National Risk Management Research Laboratory, appcd - Air Pollution Prevention & Control Division, iemb - Indoor Environment Management Branch",Small Chamber Study on Characterizing Organophosphorus Flame Retardants Sorption on Indoor Building Materials and Consumer Products,Peer Reviewed,Chemical Safety for Sustainability,
ORD-012218,Keegan  Rankin,,A Global Survey of Perfluoroalkyl Carboxylates (PFCAs) and Perfluoroalkane Sulfonates (PFSAs) in Surface Soils: Distribution Patterns and Mode of Occurrence,Peer Reviewed,Chemical Safety for Sustainability,
ORD-015166,Judy LaKind,,Exposure Science in an Age of Rapidly Changing Climate: Challenges and Opportunities,Peer Reviewed,Chemical Safety for Sustainability,
ORD-008492,Jessica  Leet,,Environmental hormones and their impacts on sex differentiation in fathead minnows,Peer Reviewed,Chemical Safety for Sustainability,11/25/2014
ORD-007898,Susan Elmore,,Meeting Report:  FutureTox II: Contemporary Concepts in Toxicology &ldquo;Pathways to Prediction: In Vitro and In Silico Models for Predictive Toxicology&rdquo;,Peer Reviewed,Chemical Safety for Sustainability,8/22/2014
ORD-012106,Andre Kleensang,,(ALTEX) Pathways of Toxicity,Peer Reviewed,Chemical Safety for Sustainability,3/27/2015
ORD-008526,Brett Gantt,,Near-road modeling and measurement of cerium-containing particles generated by nanoparticle diesel fuel additive use,Peer Reviewed,Chemical Safety for Sustainability,10/21/2014
ORD-010917,Amarendra Dwivedi,,Fate of Engineered Nanoparticles: Implications in the Environment,Peer Reviewed,Chemical Safety for Sustainability,2/18/2015
ORD-007939,Brandy Riffle,,Novel molecular events associated with altered steroidogenesis induced by exposure to atrazine in the intact and castrate male rat,Peer Reviewed,Chemical Safety for Sustainability,11/7/2014
ORD-012966,Christian Andersen,"ord - Office of Research and Development, nheerl - National Health and Environmental Effects Research Laboratory, wed - Western Ecology Division, eeb - Ecological Effects Branch",Germination and early plant development of ten plant species exposed to TiO2 and CeO2 nanoparticles,Peer Reviewed,Chemical Safety for Sustainability,
ORD-007698,Joachim Pleil,"ord - Office of Research and Development, nerl - National Exposure Research Laboratory, heasd - Human Exposure and Atmospheric Sciences Division, mdab - Methods Development and Application Branch",Exploratory breath analyses for assessing toxic dermal exposure of firefighters during suppression of structural burns,Peer Reviewed,Chemical Safety for Sustainability,11/6/2014
ORD-007388,Michael C. Alavanja,,"Non-Hodgkin Lymphoma risk and insecticide, fungicide and fumigant use in the Agricultural Health Study",Peer Reviewed,Chemical Safety for Sustainability,11/14/2014
